{
  "$defs": {
    "actor": {
      "additionalProperties": false,
      "properties": {
        "actorId": {
          "minLength": 1,
          "type": "string"
        },
        "actorType": {
          "enum": [
            "human",
            "agent",
            "kernel"
          ]
        }
      },
      "required": [
        "actorType",
        "actorId"
      ],
      "type": "object"
    },
    "exclusionRef": {
      "additionalProperties": false,
      "properties": {
        "$exclusion": {
          "$ref": "#/$defs/id"
        }
      },
      "required": [
        "$exclusion"
      ],
      "type": "object"
    },
    "gapRef": {
      "additionalProperties": false,
      "properties": {
        "$gap": {
          "$ref": "#/$defs/id"
        }
      },
      "required": [
        "$gap"
      ],
      "type": "object"
    },
    "id": {
      "pattern": "^[a-z0-9][a-z0-9._:-]*$",
      "type": "string"
    },
    "provenance": {
      "additionalProperties": false,
      "properties": {
        "extractedAt": {
          "type": "string"
        },
        "extractor": {
          "type": "string"
        },
        "locator": {
          "type": "string"
        },
        "sourceArtifact": {
          "type": "string"
        }
      },
      "required": [
        "sourceArtifact",
        "locator",
        "extractor",
        "extractedAt"
      ],
      "type": "object"
    },
    "timestamp": {
      "pattern": "^\\d{4}-\\d{2}-\\d{2}(T\\d{2}:\\d{2}:\\d{2}(\\.\\d+)?Z)?$",
      "type": "string"
    }
  },
  "$id": "https://docket.offgriddevices.com/schema/Assumption.schema.json",
  "$schema": "https://json-schema.org/draft/2020-12/schema",
  "additionalProperties": false,
  "description": "ICD 203 \u00a7D.6.e(3) fields; linchpin + gap is the Poland-bridges object.",
  "properties": {
    "confidence": {
      "enum": [
        "explicit",
        "inferred",
        "absent"
      ]
    },
    "conflictsWith": {
      "items": {
        "$ref": "#/$defs/id"
      },
      "type": "array"
    },
    "createdAt": {
      "$ref": "#/$defs/timestamp"
    },
    "createdBy": {
      "$ref": "#/$defs/actor"
    },
    "evidence": {
      "oneOf": [
        {
          "$ref": "#/$defs/id"
        },
        {
          "$ref": "#/$defs/exclusionRef"
        },
        {
          "$ref": "#/$defs/gapRef"
        }
      ]
    },
    "id": {
      "$ref": "#/$defs/id"
    },
    "implicationsIfWrong": {
      "oneOf": [
        {
          "type": "string"
        },
        {
          "$ref": "#/$defs/exclusionRef"
        },
        {
          "$ref": "#/$defs/gapRef"
        }
      ]
    },
    "indicatorsThatWouldAlter": {
      "oneOf": [
        {
          "items": {
            "type": "string"
          },
          "type": "array"
        },
        {
          "$ref": "#/$defs/exclusionRef"
        },
        {
          "$ref": "#/$defs/gapRef"
        }
      ]
    },
    "ingestionProvenance": {
      "$ref": "#/$defs/provenance"
    },
    "linchpin": {
      "type": "boolean"
    },
    "parameterBinding": {
      "additionalProperties": false,
      "properties": {
        "kind": {
          "enum": [
            "weight",
            "observation"
          ]
        },
        "target": {
          "type": "string"
        }
      },
      "required": [
        "kind",
        "target"
      ],
      "type": "object"
    },
    "rationale": {
      "oneOf": [
        {
          "type": "string"
        },
        {
          "$ref": "#/$defs/exclusionRef"
        },
        {
          "$ref": "#/$defs/gapRef"
        }
      ]
    },
    "rev": {
      "minimum": 1,
      "type": "integer"
    },
    "sensitivityResult": {
      "$ref": "#/$defs/id"
    },
    "statement": {
      "type": "string"
    },
    "supersedes": {
      "$ref": "#/$defs/id"
    },
    "type": {
      "const": "Assumption"
    },
    "variedInSensitivity": {
      "type": "boolean"
    }
  },
  "required": [
    "id",
    "type",
    "rev",
    "createdBy",
    "createdAt",
    "statement",
    "linchpin",
    "rationale",
    "evidence",
    "implicationsIfWrong",
    "indicatorsThatWouldAlter",
    "variedInSensitivity"
  ],
  "title": "Assumption",
  "type": "object"
}
